{
  "$schema": "../../../assets/modules/channel-web/config.schema.json",
  "uploadsUseS3": false,
  "uploadsS3Bucket": "bucket-name",
  "uploadsS3Region": "eu-west-1",
  "uploadsS3AWSAccessKey": "your-aws-key-name",
  "uploadsS3AWSAccessSecret": "secret-key",
  "startNewConvoOnTimeout": false,
  "recentConversationLifetime": "6 hours"
}